{
  "$schema": "./lifecycle-evidence.schema.json",
  "schemaVersion": 1,
  "libraryVersion": "0.1.2",
  "generatedBy": "scripts/generate-lifecycle-evidence.mjs",
  "artifacts": {
    "api-actions": {
      "path": "projects/kern/api/actions.api.d.ts",
      "anchor": "",
      "sha256": "sha256-ae7268d9c00a2b233672388a8c61468588db36267a4b0157443db7908c99d686"
    },
    "api-addon-charts": {
      "path": "projects/kern/api/addon-charts.api.d.ts",
      "anchor": "",
      "sha256": "sha256-c061d155f5f1e841bf4d01e7241f5171055d3eda86857b953213a97bf3b2352d"
    },
    "api-addon-grid": {
      "path": "projects/kern/api/addon-grid.api.d.ts",
      "anchor": "",
      "sha256": "sha256-25a7830627598ed9b20d83aac12539ec27973e7b19cdd3a5d47d486ff333cbed"
    },
    "api-data-display": {
      "path": "projects/kern/api/data-display.api.d.ts",
      "anchor": "",
      "sha256": "sha256-952e9c2ef80be84927cd2684e41ace81568b1d4dc9eaec684a270842ed7986b3"
    },
    "api-feedback": {
      "path": "projects/kern/api/feedback.api.d.ts",
      "anchor": "",
      "sha256": "sha256-3fedb391f6cebd9bab645e65ad8a3e5ea5c2e206cb37a9038df1e2079902e520"
    },
    "api-forms": {
      "path": "projects/kern/api/forms.api.d.ts",
      "anchor": "",
      "sha256": "sha256-2163fc898b922ddbeaf6ff6b7ea5571c9c9103c50a4e106757be9e6dac850dac"
    },
    "api-layout": {
      "path": "projects/kern/api/layout.api.d.ts",
      "anchor": "",
      "sha256": "sha256-be886012bcae0c32bc8bfc056daf947603b089357d4c93b063452db4461f1096"
    },
    "api-navigation": {
      "path": "projects/kern/api/navigation.api.d.ts",
      "anchor": "",
      "sha256": "sha256-b82ea0cf992e57943101ab6ba7b6d9137bb980fc74d5a89d6ea20e928479a5c3"
    },
    "api-patterns": {
      "path": "projects/kern/api/patterns.api.d.ts",
      "anchor": "",
      "sha256": "sha256-ac27bc5711d26762241422db3e5fe670e17649a414a9428b4f2ce75fa1a6f40d"
    },
    "catalog-a11y": {
      "path": "tests/a11y/accessibility.spec.ts",
      "anchor": "specimen has no automated WCAG violations",
      "sha256": "sha256-ece74cffc3a974fb1ba69ed477975ec6a0771dff3ff5300428d6caabc402f825"
    },
    "catalog-hydration": {
      "path": "tests/e2e/component-specimens.spec.ts",
      "anchor": "hydration preserves every server-rendered specimen node",
      "sha256": "sha256-7a9e89682be555c20abc1a50188b3334a915c481bd51f9ba851a0a39027b7a52"
    },
    "catalog-keyboard": {
      "path": "tests/e2e/quality-regressions.spec.ts",
      "anchor": "visible enabled controls are keyboard reachable without focus geometry shifts",
      "sha256": "sha256-0d3d62889aacee819a1de2190eac7cc812bd2c53b9d5ace4de92c0613e8f24e6"
    },
    "catalog-ssr": {
      "path": "tests/e2e/component-specimens.spec.ts",
      "anchor": "raw SSR response contains every exact catalog route specimen",
      "sha256": "sha256-7a9e89682be555c20abc1a50188b3334a915c481bd51f9ba851a0a39027b7a52"
    },
    "catalog-visual": {
      "path": "tests/visual/visual.spec.ts",
      "anchor": "default specimen matches its visual baseline",
      "sha256": "sha256-5a22b63e63db92b953a75a673e14aee61c5868495d5cb38a8f2afaa0f1dd61e9"
    },
    "guidance-bulk-actions": {
      "path": "projects/kern/agent/components/bulk-actions.md",
      "anchor": "## Use",
      "sha256": "sha256-10b5da5196054f051d5cc9fa817d647a59c8691493cda6efc2872547b854a088"
    },
    "guidance-crud-toolbar": {
      "path": "projects/kern/agent/components/crud-toolbar.md",
      "anchor": "## Use",
      "sha256": "sha256-c3700232e1fedb7e9a430427fc8425d1fc74a2d94b3d2c8f1a5a883b11492807"
    },
    "guidance-dashboard-widget": {
      "path": "projects/kern/agent/components/dashboard-widget.md",
      "anchor": "## Use",
      "sha256": "sha256-0d0b3e4956254b8a24634bcb375fbb3ee84fdc12ccadd6688e0bb81c63c4d61f"
    },
    "guidance-filter-bar": {
      "path": "projects/kern/agent/components/filter-bar.md",
      "anchor": "## Use",
      "sha256": "sha256-973a796dabbacec7769f0352b9cd4e84f948c99639f4436225f8dfee3e5807f4"
    },
    "guidance-global-search": {
      "path": "projects/kern/agent/components/global-search.md",
      "anchor": "## Use",
      "sha256": "sha256-d9e99554ecb3660c23564530ab30cf177321ca871ae3b9918a16cd633d24d921"
    },
    "guidance-login-form": {
      "path": "projects/kern/agent/components/login-form.md",
      "anchor": "## Use",
      "sha256": "sha256-593e94fc3dc5d720c088f3fd1eaacdd8c7d0aeca46c26381086b74171fd374ff"
    },
    "guidance-master-detail-layout": {
      "path": "projects/kern/agent/components/master-detail-layout.md",
      "anchor": "## Use",
      "sha256": "sha256-f71b6f6e4b0924e6cb5fbad8fc20f0bad57350f79520da99a7d5fdf26c15923f"
    },
    "guidance-mobile-navigation": {
      "path": "projects/kern/agent/components/mobile-navigation.md",
      "anchor": "## Use",
      "sha256": "sha256-602fd30cefcaea0eac10f737242249a63e9553be1e25632a043b704d36a64370"
    },
    "guidance-multi-step-form": {
      "path": "projects/kern/agent/components/multi-step-form.md",
      "anchor": "## Use",
      "sha256": "sha256-270e505c924b1c3027162f1c4620439a8648eba5227cb17cd8c06387274e0b90"
    },
    "guidance-notification-center": {
      "path": "projects/kern/agent/components/notification-center.md",
      "anchor": "## Use",
      "sha256": "sha256-35be2c9ea38877be44a3ad489bd96467bfa8aa2b24e7b7fdc22747bd67797d81"
    },
    "guidance-page-header": {
      "path": "projects/kern/agent/components/page-header.md",
      "anchor": "## Use",
      "sha256": "sha256-0524f6c06b7686bbde446bf47859669182bfa601d2bed69e36455bae7dcb2fbc"
    },
    "guidance-profile-form": {
      "path": "projects/kern/agent/components/profile-form.md",
      "anchor": "## Use",
      "sha256": "sha256-198f2bbb645c528bf2a67675b84c4952b9d4c74ae67f8180702c5b6cf6557fe9"
    },
    "guidance-responsive-application-shell": {
      "path": "projects/kern/agent/components/responsive-application-shell.md",
      "anchor": "## Use",
      "sha256": "sha256-063fb61cd6712b2afd90044c757ee95f24638a67b031a5016f90057263bf9aaf"
    },
    "guidance-settings-panel": {
      "path": "projects/kern/agent/components/settings-panel.md",
      "anchor": "## Use",
      "sha256": "sha256-a15f8b92912ffb419326ed2b7645617694dbf230a2fc5a0b0664c1fcd887931d"
    },
    "guidance-user-menu": {
      "path": "projects/kern/agent/components/user-menu.md",
      "anchor": "## Use",
      "sha256": "sha256-e82cd3bd4ed2622a54aa7d7dd5840b918440ccada5955f4f7bda6f82ab883226"
    },
    "harness-source-autocomplete": {
      "path": "projects/kern/testing/forms/src/selection-harness.ts",
      "anchor": "class KrnAutocompleteHarness",
      "sha256": "sha256-69e3abfe5646e7dfb65e40c9bde58da84735a0c888840aac3553e9fbef3bf909"
    },
    "harness-source-bar-chart": {
      "path": "projects/kern/testing/data-display/src/chart-harness.ts",
      "anchor": "class KrnBarChartHarness",
      "sha256": "sha256-a952ed043da43a046b48e3952b30674487684a4cd914d6c817bb82906a9afb10"
    },
    "harness-source-bottom-sheet": {
      "path": "projects/kern/testing/feedback/src/overlay-harness.ts",
      "anchor": "class KrnBottomSheetHarness",
      "sha256": "sha256-52baa0060570dcb6feca8fa636a70cc13c4f012eda7b38f45d7d61caa6de233a"
    },
    "harness-source-color-picker": {
      "path": "projects/kern/testing/forms/src/color-picker-harness.ts",
      "anchor": "class KrnColorPickerHarness",
      "sha256": "sha256-6d3d9c1dfcbdeed38bbece7c9c8cf7d370c38b912f845a453155329131ae4054"
    },
    "harness-source-combobox": {
      "path": "projects/kern/testing/forms/src/selection-harness.ts",
      "anchor": "class KrnComboboxHarness",
      "sha256": "sha256-69e3abfe5646e7dfb65e40c9bde58da84735a0c888840aac3553e9fbef3bf909"
    },
    "harness-source-command-palette": {
      "path": "projects/kern/testing/navigation/src/command-palette-harness.ts",
      "anchor": "class KrnCommandPaletteHarness",
      "sha256": "sha256-f633d220ab62f64116fd7e7300c1914eb1956c187965a4aa93cd42a7044ae79d"
    },
    "harness-source-data-grid": {
      "path": "projects/kern/testing/data-display/src/data-grid-harness.ts",
      "anchor": "class KrnDataGridHarness",
      "sha256": "sha256-0d7c456810cc0c039d44b9309373239cac422df9f8559307b60d552e2b7881a7"
    },
    "harness-source-data-table": {
      "path": "projects/kern/testing/data-display/src/data-grid-harness.ts",
      "anchor": "class KrnDataGridHarness",
      "sha256": "sha256-0d7c456810cc0c039d44b9309373239cac422df9f8559307b60d552e2b7881a7"
    },
    "harness-source-date-picker": {
      "path": "projects/kern/testing/forms/src/date-time-harness.ts",
      "anchor": "class KrnDatePickerHarness",
      "sha256": "sha256-699422f479127c8852dbe745ece7a4d886abafb8ad0411a2776f742ae2f2c8f6"
    },
    "harness-source-date-range-picker": {
      "path": "projects/kern/testing/forms/src/date-time-harness.ts",
      "anchor": "class KrnDateRangePickerHarness",
      "sha256": "sha256-699422f479127c8852dbe745ece7a4d886abafb8ad0411a2776f742ae2f2c8f6"
    },
    "harness-source-dialog": {
      "path": "projects/kern/testing/feedback/src/overlay-harness.ts",
      "anchor": "class KrnDialogHarness",
      "sha256": "sha256-52baa0060570dcb6feca8fa636a70cc13c4f012eda7b38f45d7d61caa6de233a"
    },
    "harness-source-donut-chart": {
      "path": "projects/kern/testing/data-display/src/chart-harness.ts",
      "anchor": "class KrnDonutChartHarness",
      "sha256": "sha256-a952ed043da43a046b48e3952b30674487684a4cd914d6c817bb82906a9afb10"
    },
    "harness-source-drawer": {
      "path": "projects/kern/testing/feedback/src/overlay-harness.ts",
      "anchor": "class KrnDrawerHarness",
      "sha256": "sha256-52baa0060570dcb6feca8fa636a70cc13c4f012eda7b38f45d7d61caa6de233a"
    },
    "harness-source-json-view": {
      "path": "projects/kern/testing/data-display/src/json-view-harness.ts",
      "anchor": "class KrnJsonViewHarness",